<?xml version="1.0" ?><tns:userlist xmlns:tns="http://www.example.org/userSchema" xmlns:xsi="http://www.w3.org/2001/XMLSchema-instance" xsi:schemaLocation="http://www.example.org/userSchema userSchema.xsd ">
  <tns:user>
  	<tns:name>admin</tns:name>
  	<tns:password>admin</tns:password>
  	<tns:friends>
  		<tns:name>admin</tns:name>
  		<tns:name>xd</tns:name>
  	<tns:name>moon</tns:name></tns:friends>
  </tns:user>
  <tns:user>
  	<tns:name>xd</tns:name>
  	<tns:password>apples9</tns:password>
  	<tns:friends>
  		<tns:name>admin</tns:name>
  		<tns:name>moon</tns:name>
  	</tns:friends>
  </tns:user>
  <tns:user>
    <tns:name>cvs</tns:name>
    <tns:password>apples</tns:password>
    <tns:friends>
      <tns:name>admin</tns:name>
      <tns:name>moon</tns:name>
    </tns:friends>
  </tns:user>
  <tns:user>
  	<tns:name>moon</tns:name>
  	<tns:password>password</tns:password>
  	<tns:friends>
  		<tns:name>admin</tns:name>
  	</tns:friends>
  </tns:user>
  <tns:user>
  	<tns:name>tns:name</tns:name>
  	<tns:password>zz</tns:password>
  	<tns:friends>
  		<tns:name>xd</tns:name></tns:friends>
  </tns:user>
<tns:user><tns:name>cc</tns:name><tns:password>apples</tns:password><tns:friends><tns:name>admin</tns:name><tns:name>mm</tns:name></tns:friends></tns:user><tns:user><tns:name>mm</tns:name><tns:password>apples</tns:password><tns:friends><tns:name>admin</tns:name></tns:friends></tns:user></tns:userlist>